{
    "description": "TAPPaaS Module Registry - All known modules and their VMID assignments.",
    "vmidConventions": {
        "summary": "VMID ranges are allocated by module type. Numbers are assigned in increments of 10, giving each module a block of 10 VMIDs for the local TAPPaaS administrator to create multiple copies of the same module/app.",
        "ranges": {
            "100-200": "Foundation modules (core platform infrastructure)",
            "201-499": "Application modules \u2014 NixOS/Linux-based services",
            "500-599": "Application modules \u2014 Windows Server-based services",
            "600-799": "Application modules \u2014 general services",
            "800-899": "Application modules \u2014 network and infrastructure",
            "900-999": "Test modules (used for VM creation testing and templates)",
            "8000-9000": "Proxmox templates (VM templates used for cloning)"
        },
        "allocationRule": "VMIDs are allocated in increments of 10. For example, if an application like litellm is assigned VMID 310, then VMIDs 310-319 are reserved for that module. This allows the local administrator to deploy multiple instances of the same module."
    },
    "foundationModules": [
        {
            "moduleName": "firewall",
            "repo": "foundation",
            "moduleJson": "src/foundation/firewall/firewall.json",
            "vmid": 110,
            "stack": "foundation",
            "category": "platform"
        },
        {
            "moduleName": "tappaas-cicd",
            "repo": "foundation",
            "moduleJson": "src/foundation/tappaas-cicd/tappaas-cicd.json",
            "vmid": 130,
            "stack": "foundation",
            "category": "platform"
        },
        {
            "moduleName": "identity",
            "repo": "foundation",
            "moduleJson": "src/foundation/identity/identity.json",
            "vmid": 140,
            "stack": "security",
            "category": "identity"
        },
        {
            "moduleName": "logging",
            "repo": "foundation",
            "moduleJson": "src/foundation/logging/logging.json",
            "vmid": 150,
            "stack": "foundation",
            "category": "observability"
        },
        {
            "moduleName": "backup",
            "repo": "foundation",
            "moduleJson": "src/foundation/backup/backup.json",
            "vmid": 0,
            "stack": "foundation",
            "category": "backup"
        }
    ],
    "applicationModules": [
        {
            "moduleName": "litellm",
            "repo": "application",
            "moduleJson": "src/apps/litellm/litellm.json",
            "vmid": 310,
            "stack": "ai",
            "category": "inference"
        },
        {
            "moduleName": "openwebui",
            "repo": "application",
            "moduleJson": "src/apps/openwebui/openwebui.json",
            "vmid": 311,
            "stack": "ai",
            "category": "interface"
        },
        {
            "moduleName": "vllm-amd",
            "repo": "application",
            "moduleJson": "src/apps/vllm-amd/vllm-amd.json",
            "vmid": 312,
            "stack": "ai",
            "category": "inference"
        },
        {
            "moduleName": "vaultwarden",
            "repo": "application",
            "moduleJson": "src/apps/vaultwarden/vaultwarden.json",
            "vmid": 610,
            "stack": "security",
            "category": "credentials"
        },
        {
            "moduleName": "windows-server",
            "repo": "application",
            "moduleJson": "src/apps/windows-server/windows-server.json",
            "vmid": 500,
            "stack": "application",
            "category": "desktop"
        },
        {
            "moduleName": "netbird-client",
            "repo": "application",
            "moduleJson": "src/apps/netbird-client/netbird-client.json",
            "vmid": 800,
            "stack": "infrastructure",
            "category": "network"
        },
        {
            "moduleName": "unifi",
            "repo": "application",
            "moduleJson": "src/apps/unifi/unifi.json",
            "vmid": 810,
            "stack": "infrastructure",
            "category": "network"
        }
    ],
    "proxmoxTemplates": [
        {
            "moduleName": "template",
            "moduleJson": "src/foundation/templates/template.json",
            "vmid": 8080
        },
        {
            "moduleName": "tappaas-winserver",
            "moduleJson": "src/foundation/templates/tappaas-winserver.json",
            "vmid": 8081
        }
    ],
    "testModules": [
        {
            "moduleName": "test-debian",
            "moduleJson": "src/foundation/tappaas-cicd/test-vm-creation/test-debian.json",
            "vmid": 901
        },
        {
            "moduleName": "test-debian-vlan-node",
            "moduleJson": "src/foundation/tappaas-cicd/test-vm-creation/test-debian-vlan-node.json",
            "vmid": 902
        },
        {
            "moduleName": "test-debian-nonode",
            "moduleJson": "src/foundation/tappaas-cicd/test-vm-creation/test-debian-nonode.json",
            "vmid": 903
        },
        {
            "moduleName": "test-debian-node3-noha",
            "moduleJson": "src/foundation/tappaas-cicd/test-vm-creation/test-debian-node3-noha.json",
            "vmid": 904
        },
        {
            "moduleName": "test-ubuntu-vlan",
            "moduleJson": "src/foundation/tappaas-cicd/test-vm-creation/test-ubuntu-vlan.json",
            "vmid": 905
        },
        {
            "moduleName": "test-nixos",
            "moduleJson": "src/foundation/tappaas-cicd/test-vm-creation/test-nixos.json",
            "vmid": 911
        },
        {
            "moduleName": "test-nixos-vlan-node",
            "moduleJson": "src/foundation/tappaas-cicd/test-vm-creation/test-nixos-vlan-node.json",
            "vmid": 912
        },
        {
            "moduleName": "template",
            "moduleJson": "src/apps/00-Template/template.json",
            "vmid": 999
        }
    ]
}